{
  "assessment_set_version": "0.1.0",
  "assessed_at": "2026-08-29T16:48:00-07:00",
  "assessment_scope": "Bootstrap filter-response records against evidence ledger version 0.1.0.",
  "assessments": [
    {
      "assessment_version": "0.1.0",
      "record_id": "asr:filter.high-pass",
      "assessed_at": "2026-08-29T16:48:00-07:00",
      "dimensions": {
        "semantic_stability": {
          "score": 2,
          "basis": "EV-003 establishes the canonical filter-response concept, while EV-002 documents the adjacent Low Cut product label.",
          "evidence_ids": [
            "EV-002",
            "EV-003"
          ],
          "limitations": [
            "The corpus has not resolved whether Low Cut is an exact alias in all relevant audio contexts."
          ]
        },
        "independent_usage": {
          "score": 2,
          "basis": "EV-002 provides one documented target-product implementation, supported by independent education evidence.",
          "evidence_ids": [
            "EV-002",
            "EV-003"
          ],
          "limitations": [
            "Only one target compact implementation is documented.",
            "Education evidence does not establish target-glyph deployment."
          ]
        },
        "text_and_accessibility": {
          "score": 1,
          "basis": "The canonical term is source-supported, while HPF and the spoken label remain drafted fallbacks.",
          "evidence_ids": [
            "EV-003"
          ],
          "limitations": [
            "The current ledger does not directly document HPF as independent plain-text interchange."
          ]
        },
        "visual_convergence": {
          "score": 1,
          "basis": "EV-002 documents one compact product response selector.",
          "evidence_ids": [
            "EV-002"
          ],
          "limitations": [
            "No second independent compact target rendering is currently recorded."
          ]
        },
        "overlap_audit": {
          "score": 1,
          "basis": "EV-001 records a preliminary Unicode NamesList search with no semantic equivalent identified.",
          "evidence_ids": [
            "EV-001"
          ],
          "limitations": [
            "A reproducible visual-confusability, sequence, and adjacent-standard audit is not yet recorded."
          ]
        },
        "legal_provenance": {
          "score": 3,
          "basis": "All cited sources carry rights notes, no third-party artwork is imported, and no reference asset is published.",
          "evidence_ids": [
            "EV-001",
            "EV-002",
            "EV-003",
            "EV-004"
          ],
          "limitations": []
        }
      },
      "total_score": 10,
      "counterevidence": [
        {
          "description": "EV-004 is circuit-diagram notation, not evidence that the compact audio-community high-pass response glyph is standardized.",
          "status": "resolved",
          "evidence_ids": [
            "EV-004"
          ],
          "material": false
        }
      ],
      "material_open_questions": [
        {
          "description": "Whether Low Cut is an exact alias of High-pass filter across the intended corpus.",
          "status": "open",
          "evidence_ids": [
            "EV-002",
            "EV-003"
          ],
          "material": true
        }
      ],
      "hard_blockers": [],
      "result": {
        "recommended_status": "evidence-collecting",
        "eligible": false,
        "failed_requirements": [
          "Total score is below 13.",
          "Semantic stability score is below 3.",
          "Text and accessibility score is below 2.",
          "Visual convergence score is below 2.",
          "Overlap audit score is below 2.",
          "A material alias question remains open."
        ],
        "rationale": "The semantic concept is strong enough to retain, but cross-vendor compact rendering, independent text-use evidence, and alias resolution are not yet sufficient."
      },
      "review": {
        "independent_agent_review": "not-requested",
        "public_review_days": 0,
        "public_review_reference": null
      },
      "human_review": {
        "required": false,
        "authorization_status": "not-required",
        "authorization_reference": null
      },
      "status_at_assessment": "evidence-collecting"
    },
    {
      "assessment_version": "0.1.0",
      "record_id": "asr:filter.low-pass",
      "assessed_at": "2026-08-29T16:48:00-07:00",
      "dimensions": {
        "semantic_stability": {
          "score": 2,
          "basis": "EV-003 establishes the canonical filter-response concept, while EV-002 documents the adjacent High Cut product label.",
          "evidence_ids": [
            "EV-002",
            "EV-003"
          ],
          "limitations": [
            "The corpus has not resolved whether High Cut is an exact alias in all relevant audio contexts."
          ]
        },
        "independent_usage": {
          "score": 2,
          "basis": "EV-002 provides one documented target-product implementation, supported by independent education evidence.",
          "evidence_ids": [
            "EV-002",
            "EV-003"
          ],
          "limitations": [
            "Only one target compact implementation is documented.",
            "Education evidence does not establish target-glyph deployment."
          ]
        },
        "text_and_accessibility": {
          "score": 1,
          "basis": "The canonical term is source-supported, while LPF and the spoken label remain drafted fallbacks.",
          "evidence_ids": [
            "EV-003"
          ],
          "limitations": [
            "The current ledger does not directly document LPF as independent plain-text interchange."
          ]
        },
        "visual_convergence": {
          "score": 1,
          "basis": "EV-002 documents one compact product response selector.",
          "evidence_ids": [
            "EV-002"
          ],
          "limitations": [
            "No second independent compact target rendering is currently recorded."
          ]
        },
        "overlap_audit": {
          "score": 1,
          "basis": "EV-001 records a preliminary Unicode NamesList search with no semantic equivalent identified.",
          "evidence_ids": [
            "EV-001"
          ],
          "limitations": [
            "A reproducible visual-confusability, sequence, and adjacent-standard audit is not yet recorded."
          ]
        },
        "legal_provenance": {
          "score": 3,
          "basis": "All cited sources carry rights notes, no third-party artwork is imported, and no reference asset is published.",
          "evidence_ids": [
            "EV-001",
            "EV-002",
            "EV-003",
            "EV-004"
          ],
          "limitations": []
        }
      },
      "total_score": 10,
      "counterevidence": [
        {
          "description": "EV-004 is circuit-diagram notation, not evidence that the compact audio-community low-pass response glyph is standardized.",
          "status": "resolved",
          "evidence_ids": [
            "EV-004"
          ],
          "material": false
        }
      ],
      "material_open_questions": [
        {
          "description": "Whether High Cut is an exact alias of Low-pass filter across the intended corpus.",
          "status": "open",
          "evidence_ids": [
            "EV-002",
            "EV-003"
          ],
          "material": true
        }
      ],
      "hard_blockers": [],
      "result": {
        "recommended_status": "evidence-collecting",
        "eligible": false,
        "failed_requirements": [
          "Total score is below 13.",
          "Semantic stability score is below 3.",
          "Text and accessibility score is below 2.",
          "Visual convergence score is below 2.",
          "Overlap audit score is below 2.",
          "A material alias question remains open."
        ],
        "rationale": "The semantic concept is strong enough to retain, but cross-vendor compact rendering, independent text-use evidence, and alias resolution are not yet sufficient."
      },
      "review": {
        "independent_agent_review": "not-requested",
        "public_review_days": 0,
        "public_review_reference": null
      },
      "human_review": {
        "required": false,
        "authorization_status": "not-required",
        "authorization_reference": null
      },
      "status_at_assessment": "evidence-collecting"
    },
    {
      "assessment_version": "0.1.0",
      "record_id": "asr:filter.band-pass",
      "assessed_at": "2026-08-29T16:48:00-07:00",
      "dimensions": {
        "semantic_stability": {
          "score": 2,
          "basis": "EV-003 establishes band-pass frequency-response semantics.",
          "evidence_ids": [
            "EV-003"
          ],
          "limitations": [
            "No independent target-product corpus is yet linked to the compact band-pass representation."
          ]
        },
        "independent_usage": {
          "score": 1,
          "basis": "EV-003 provides one independent educational source for the concept.",
          "evidence_ids": [
            "EV-003"
          ],
          "limitations": [
            "No documented target compact implementation or actual use is in the current ledger."
          ]
        },
        "text_and_accessibility": {
          "score": 1,
          "basis": "The canonical term is source-supported, while BPF and the spoken label remain drafted fallbacks.",
          "evidence_ids": [
            "EV-003"
          ],
          "limitations": [
            "The current ledger does not directly document BPF as independent plain-text interchange."
          ]
        },
        "visual_convergence": {
          "score": 0,